{
    "id": 1,
    "name": "Passau Big theatre",
    "employment": [
        {
            "year": 2022, 
            "number": 1000
        },
        {
            "year": 2023, 
            "number": 2000
        }
    ],
    "performances": [
        {
            "name": "Romeo and J",
            "janre": "Drama",
            "startDate": "2023-04-01T22:33:00",
            "duration": {
                "value": 2,
                "unit": "HUR"
            }
        },
        {
            "name": "Trololo",
            "janre": "Comedy",
            "startDate": "2023-04-01T23:33:00",
            "duration": {
                "value": 2,
                "unit": "HUR"
            }
        }
    ]
}